title,pub_date,site,description
"Fight or Flight? : Evolutionary Medical Structure of Immunology, its Philosophical Implications",2017-03-31,"Philosophy of Science,in Korean","
Fight or Flight ? : Evolutionary Medical Structure of Immunology, its Philosophical Implications
Jongduck Choi
The aim of my paper is to interpret diverse relations between host and parasite by integrating evolutionary medicine and immunology. An immunological thinking could be reconstructed by specific metaphors such as ‘fighting’, ‘killing’, ‘protection’, ‘immune evasion’, ‘seizure’, or ‘coexistence’. The response of infectious microbes against the host’s attack, where the strained relations between microbes and immune system are activating, directs toward for their own surviving and reproducing through the incessant mutations of microbes as like bacteria and virus do. I will hereby show that the very philosophical category of evolutionary immunology might be formed through my thesis. It is to be unfolded as below. Firstly, I will arrange the evolutionary etiology. Secondly, I show that infectious diseases could be explained well by using the immunological metaphors. Thirdly, the relation between an evolutionary mutation of parasite and immunological activation of host will be illuminated by the concrete cases such as antibiotic, vaccine, and AZT. Fourthly, it will be highlighted that the evolution speed of mutation’s rate for infectious virus exceeds the capacity of horotelic human’s immunity. Lastly, it will be recognized that antibiotic biomedicine or antiviral medicine ultimately do not succeed in doing their role. So I suggest the necessity of medical preparation with concept of coalescence between human and microbes. My conclusion is that medical preparation of that kind of coalescence can be found in the integration of evolutionary medicine and cell based immunology.
<Keywords> immunology, evolutionary medicine, vulnerability to diseases, mutation, AZT, symbiosis and coevolution, coalescence
<References>

Bergstrom, C. T. & Feldgarden, M. (2008), “The Ecology and Evolution of Antibiotic-Resistant Bacteria”, in Stearns, S. C. & Koella, J. C. (eds.) Evolution in health and disease, 2nd ed., Oxford, UK: Oxford University Press.
Boyer, P., Sarafianos, S, Arnold, E. & Hughes, S. (2001), “Selective Excision of AZTMP by Drug-Resistant Human Immunodeficiency Virus Reverse Transcriptase”, Journal of virology 75(10): pp. 4832-42.
Campisi, J. (2003), “Cancer and Ageing: Rival Demons?” Nature Reviews Cancer 3: pp. 339-49.
Cournoyea, M. (2013), “Ancestral Assumptions and the Clinical Uncertainty to Evolutionary Medicine”, Perspectives in Biology and Medicine, 56(1): pp. 36-52.
Cann, A. (2005), Principles of Molecular Virology, 4th ed, Academic Press.
Diacovich, L. & Gorvel, J. P. (2010), “Bacterial Manipulation of Innate Immunity to Promote Infection”, Nature Reviews Microbiology 8: pp. 117-28.
Eaton, B. & Stanley B. (2003), “An Evolutionary Perspective on Human Physical Activity: Implications for Health”, Comparative Biochemistry and Physiology Part A 136: pp. 153-59.
Eaton, S., Cordain, L. & Lindeberg, S. (2002), “Evolutionary Health Promotion: a Consideration of Common Counter Arguments”, Preventive Medicine: An International Journal Devoted to Practice and Theory 34(2): pp. 119-23.
Ewald P. W. (1980), “Evolutionary Biology and the Treatment of Signs and Symptoms of Infectious Disease”, Journal of Theoretical Biology 86: pp. 169-76.
(1999), “Evolutionary Control of HIV and Other Sexually Transmitted Viruses“, in Trevathan, W. et al. (eds.) Evolutionary Medicine, New York: Oxford University Press.
(1993), Evolution of Infectious Disease, New York: Oxford University Press.
Gkuckmann, P. Beedle, A. & Hanson, M. (2009), Principles of Evolutionary Medicine, Oxford.
Greaves, M. (2007), “Darwinian Medicine: a Case for Cancer”, Nature Reviews Cancer 7(3): pp. 213-21.
Hajishengallis, G. & Lambris, J. D. (2011), “Microbial Manipulation of Receptor Cross Talk in Innate Immunity”, Nature Reviews Immunology 11(3): pp. 187-200.
Hanson, N. & Lanning, D. (2008), “Microbial Induction of B and T Cell Areas in Rabbit Appendix”, Developmental & Comparative Immunology 32(8): pp. 980-91.
Herron, J. & Freeman, S. (2014), Evolutionary Analysis, 5th ed, Pearson.
Hogg, R., Montaner, J., Wood, E. et al. (2006), “The Case for Expanding Access to Highly Active Antiretroviral Therapy to Curb the Growth of the HIV Epidemic”, The Lancet 368(9534): pp. 531-36.
Kato, S. et al. (2015), “Global Brain Dynamics Embed the Another Command Sequence of Caenorhabditis Elegans”, Cell 163(3): pp. 656-69.
Kweon, M. et al. (2016), “Enteric Viruses Ameliorate Gut Inflammation Via Toll-Like Receptor 3 and Toll-Like Receptor 7-Mediated Interferon-β Production”, Immunity 44(4): pp. 889-900.
Lachmann, P., Lachmann, P. J. & Oldstone, M. B. A. (2006), Microbial Subversion of Immunity, Norfolk, UK: Caister Academic Press.
Larder, B. A., Darby, G. & Richman, D. D. (1989), “HIV with Reduced Sensitivity to Zidovudine (AZT) Isolated During Prolonged Therapy” Science 243(4899): pp. 1731-35.
Lazano, G. A. (2010), “Evolutionary Explanations in Medicine: How Do They Differ and How to Benefit from Them”, Medical Hypotheses 74(4): pp. 746-49.
Levin B. R. & Anderson R. M. (1999), “The Population Biology of Anti-Infective Chemotherapy and the Evolution of Resistance: More Questions Than Answers”, in Stearns, S. (ed.), Evolution in Health and Disease, New York: Oxford University Press.
Moxon, R. R., Bayliss, C. C. & Hood, D. D. (2005), “Bacterial Contingency Loci: the Role of Simple Sequence DNA Repeats in Bacterial Adaptation”, Annu. Rev. Genet. 40: pp. 307-33.
Nachman M. W. & Crowell S. L. (2000), “Estimate of the Mutation Rate Per Nucleotide in Humans”, Genetics 156(1): pp. 297-304.
Nesse, R. M. & Williams, G. C. (1994), Why We Get Sick: the New Science of Darwinian Medicine, Time Books.
Nesse, R. M. (2005), “Maladaptation and Natural Selection”, Quaterly Review of Biology (1): pp. 62-71.
___________ (2012), “Evolution: a Basic Science for Medicine”, in Poiani, A. (ed.), Pragmatic Evolution: Applications of Evolutionary Theory, Cambridge Univ. Press.
Perez-Caballero, D., Zang, T. et al. (2009), “Tetherin Inhibits HIV-1 Release by Directly Tethering Virions to Cells”, Cell 139(3): pp. 499-511.
Price, D. A., Goulder, P. J. et al. (1997), “Positive Selection of HIV-1 Cyto-Toxic T Lymphocyte Escape Variants During Primary Infection”, Proceedings of the National Academy of Sciences USA 94(5): pp. 1890-95.
Purrmann, J. et al. (1992), “Association of Crohn’s Disease and Multiple Sclerosis: Is There a Common Background?”, Journal of Clinical Gastroenterology, 14(1): pp. 43-46.
Raberg, L., Graham, A. L. & Read, A. F. (2009), “Decomposing Health: Tolerance and Resistance to Parasites in Animals”, Philosophical Transactions of the Royal Society of London B: Biological Sciences 364(1513): pp. 37-49.
Read, A. F., Day, T. & Huijben, S. (2011), “The Evolution of Drug Resistance and the Curious Oxthodoxy of Aggressive Chemotheraphy”, Proceedings of the National Academy of Sciences, 108(Supplement 2): pp. 10871-10877.
Sacks O. (2010), “Face-Blind: Why Are Some of Us Terrible at Recognizing Faces?”, New Yorker(Aug. 30, 2010): pp. 36-43.
Sauter, D., Schindler, M. et al. (2009), “Tetherin-Driven Adaptation of Vpu and Nef Function and the Evolution of Pandemic and Non Pandemic HIV-1 Strains”, Cell Host Microbe 6(5): pp. 409-21.
Schneider, D. S. & Ayres, J. S. (2008), “Two Ways to Survive Infection: What Resistance and Tolerance Can Teach Us About Treating Infectious Diseases”, Nature Reviews Immunology 8(11): pp. 889-895 .
Shankarappa, R. et al. (1999), “Consistent Viral Evolutionary Changes Associated With the Progression of Human Immunodeficiency Virus Type 1 Infection”, Journal of Virology 73(12): 10489-502.
St Clair, W. H. et al. (1991), “Influence of Proliferation on DNA Repair Rates in Liver”, Experimental Cell Research, 197(2): pp. 323-25.
Stearns, S. C. (2012), “Evolutionary Medicine: Its Scope, Interest and Potential”, Proceeding of the Royal British Society 279: pp. 4305-21.
Strachan, D. P. (2000). “Family Size, Infection and Atopy: the First Decade of the ‘Hygiene Hypothesis’”, Thorax 55(1): pp. 2-10.
Varki, A. (2012), “Nothing in Medicine Makes Sense, Except in the Light of Evolution”, Journal of Molecular Medicine 90(5): pp. 481-94.
Xue, Y. et al. (2009), “Human Y Chromosome Base-Substitution Mutation Rate Measured by Direct Sequencing in a Deep-Rooting Pedigree”, Current Biology (17): pp. 1453-57.
Yap, M. W., Nisole, S. & Stoye, J. P. (2005), “A Single Amino Acid Change in the SPRY Domain of Human TRIMa Leads to HIV-1 Restriction”, Current Biology 15(1): pp. 73-78.
Yazdanbakhsh, M., Kremsner, P. G. & Van Ree, R. (2002), “Allergy, Parasites and the Hygine Hypothesis”, Science 296(5567): pp. 490-94.
Zampieri, F. (2009), “Origin and History of Darwinian Medicine”, Human Mente 9: pp. 13-38.

"
"History of the Evolutionary Medicine  And Its Applicability To Medical Education",2016-12-31,"Philosophy of Medicine Nr.21(2016) in Korean","
History of the Evolutionary Medicine 
And Its Applicability To Medical Education 
Choi, Jongduck
<abstract>
The purpose of this paper is to show direction how historical epistemology of the evolutionary medicine and functionalistic methodology of clinical medicine can be integrated. In order to carry out the purpose, I, first of all, describe the history of evolutionary thinking which has been emerged in the first half of the 19th century. Second, I arrange the evolutionary theory which has been established by Charles Darwin, by the viewpoints of the medical affairs. Third, it is covered in my demonstration how the Darwin’s evolutionary theory had been distorted in socially and medically eugenics. I show that the evolutionary theory had been falsely represented in the name of ‘medical Darwinism’, which called by Zampieri. I furthermore clarify how and why the duration of medical Darwinism could have lasted for the 60 years just before WW II. Then, hereby, I exhibit the details of the epistemological base and etiology of the evolutionary medicine. Lastly I analyze the reasons why the evolutionary medicine has been excluded in the clinical medicine. If those reasons can be clarified, it would be useful for the evolutionary medicine to enter into current curriculum of medical education as well. This paper aims ultimately to examine those possibilities.
 
<Keywords> Evolution, Evolutionary Medicine, Vulnerability to Disease, View of Body, Medical Education, Human Medicine
<References>

AAMC-HHMI (2009), Annual Report 2009
Aitken W. (1885), “Darwin’s Doctrine of Evolution in Explanation of the Coming into Being of some Disease.”, Glasgow Medical Journal 24
Antonovics, J., Abbate, J.L., Baker, C.H., et al. (2007), “Evolution by any other name: antibiotic resistance and avoidance of the e-word.”, PLoS Biology 5(2)
Appel, T. A. (1987), The Cuvier-Geoffroy debate: French biology in the decades before Darwin., New York: Oxford University Press
Bishop, Paul 2008, Analytical Psychology and German Classical Aesthetics: Goethe, Schiller, and Jung Volume 2: The Constellation of the Self, Taylor & Francis
Blackman, H. J. (2006), “Anatomy and embryology in medical education at Cambridge University, 1866-1900.”, Med Educ 40(3)
Bland-Sutton J. (1890), Evolution and Disease, London: Walter Scott
Bowler, P. (1992), The eclipse of Darwinism: anti-Darwinian evolution theories in the decades around 1900., Baltimore: John Hopkins University Press
Buklijas T, Low FM, Beedle AS, Gluckman PD (2011), “Developing a curriculum for evolutionary medicine: case studies of scurvy and female reproductive tract cancers.”, Evo Edu Outreach 4
Buklijas, T. (2012). The politics of fin-de-siecle anatomy. In M. G. Ash, J. Surman (Eds.) The nationalization of scientific knowledge in the Habsburg empire, 1848-1918 (pp.209-244). London: Macmillan.
Childs, B. (1999), Genetic Medicine: A Logic of Disease, Johns Hopkins University Press, Baltimore, MD.
Desmond, A. J. (1989), The politics of evolution: morphology, medicine and reform in radical London., Chicago: The University of Chicago Press
Dobzansky, T. (1937), Genetics and the Origin of Species. Columbia University Press
Dubos R. (1965), Man Adapting., New Haven, London: Yale University Press
Eaton S. B. (1990), “Fibre Intake in Prehistoric Times.”, in Dietary Fibre
Ewald (1994), Evolution of Infectious Disease. Oxford University Press.
Ewald P. W. (1999), Evolutionary Control of HIV and Other Sexually Transmitted Viruses. pp.271-311 in Evolutionary Medicine, edited by W. Trevathan et al., New York:Oxford University Press
Gluckman, P. D., A. S. Beedle, et al. (2009), Principles of evolutionary medicine., Oxford: Oxford University Press.
Greaves, Mel (2007), “Darwinian medicine: a case for cancer”, Nature Reviews (Cancer) vol. 7(Mar.)
Hutchinson J. (1884), The Pedigree of Disease; Being Six Lectures on Temperament, Idiosyncrasy and Diathesis., London: J. &A. Churchill.
Kincaid, H. and Mckitrick, J. (eds) (2007), Establishing Medical Reality, Springer.
Levin B. R., Anderson R. M. (1999), The Population Biology of Anti-Infective Chemotherapy and the Evolution of Resistance: More Questions than Answers: (125-137) In Evolution in Health & Disease, edited by S. Stearns., New York: Oxford University Press
Maclagan T. J. (1888), Fever, A Clinical Study., London: Churchill.
Mayr E. (1982), The Growth of Biological Thought. Diversity, Evolution, and Inheritance., London: The Belknap Press of Harvard University Press.
Mayr, E. (1942). Systematics and the Origin of Species, from the Viewpoint of a Zoologist. Cambridge: Harvard University Press.
McGuire M. T., Troisi A. (1998), Darwinian Psychiatry., New York: Oxford University Press
Montgomery, K. (2006), How Doctors Think: Clinical Judgment and the Practice of Medicine, Oxford: Oxford University Press.
Nesse R. M. (2005), “Maladaptation and Natural Selection.”, The Quarterly Reviwe of Biology 80(1): pp.62-71
Nesse R. M. and Williams G.C. (1994), Why we get sick: the new science of darwinian medicine., Time Books, New York.
Nesse, R. M. and J. D. Schiffman (2003), “Evolutionary biology in the medical school curriculum.”, Bio Science 53(6): pp.585-587
Nesse, R.M. and Stearns, S.C. (2008), “The great opportunity: evolutionary applications to medicine and public health. “, Evolutionary Applications 1: pp.28–48
Nyhart, L. (1995), Biology takes form: animal morphology and the German universities, 1800-1900., Chicago: University of Chicago Press.
Roberts M. (1926), Malignancy and Evolution: A Biological Inquiry into the Nature and Causes of Cancer., London: Eveleigh Nash &Grayson.
Ruse, M. (1995) Evolutionary naturalism: selected essays
Sacks, Oliver (1999), Awakenings , Vintage Books.
Starr O. (1925), Lamarck-Darwinism and Dental Disease., London: George Routledge and Sons, Ltd.
Stearns (1999), Evolution in Health and Disease, Oxford University Press
Stearns, Stephen C. (2012), “Evolutionary Medicine: its scope, interest and potential”, In: Proceeding of the Royal British Society 279: pp.4305-4321
Tracy S. W. (1992), “George Draper and American Constitutional Medicine, 1916-1946: Reinventing the Sick Man.”, Bulletin of the History of Medicine 1: pp.53-89
Trevathan W R., McKenna J. J., Smith E. O., editors. (2007), Evolutionary Medicine and Health: New Perspectives., New York: Oxford University Press.
Trevathan W. R., McKenna J. J., Smith E. O., editors. (1999), Evolutionary Medicine., New York: Oxford University Press.
Varki, Ajit (2012), “Nothing in medicine makes sense, except in the light of evolution “, J. Mol. Med. 90
Weismann (1902), Vorträge über Deszendenztheorie: Gehalten an der Universität zu Freiburg im Breisgau. Fischer, Jena. 2 volums
Williams, G. C. and R. M. Nesse (1991), “The dawn of Darwinian medicine.”, Q Rev Biol 66(1), pp.1-22
Williams, G.C. 1966. Adaptation and Natural Selection. Princeton University Press, Princeton, N.J.
Zampieri, F. (2009), “Origin and History of Darwinian Medicine”, Human Mente Issue9.

"
"New Paradigm in Human Ecology",2016-09-22," ","
New Paradigm and Planetary Engagement: A Call for Responsibility
New Paradigm in Human Ecology
"
